{
  "$schema": "./brand.schema.json",
  "$comment": "Single source of truth for brand identity (everything a rebrand edits, except the logo SVGs in assets/brand/ and the OAuth signing keypair in oauth.public-jwks.json). Consumed by the app via the typed adapters src/config/brand.ts (identity/links/services), brand-theme.ts (colors) and oauth.ts (oauth), and directly by the Node build scripts, app.config.js and the Cloudflare Workers. Field docs live in brand.schema.json.",
  "name": "oso",
  "hosts": ["oso.social", "dev.oso.social"],
  "socialHandle": "",
  "colors": {
    "neutral": {
      "contrast_0": "#F1F1EF",
      "contrast_25": "#EAEAE7",
      "contrast_50": "#E3E3DF",
      "contrast_100": "#D9D9D4",
      "contrast_200": "#C5C4BF",
      "contrast_300": "#ABAAA6",
      "contrast_400": "#92918E",
      "contrast_500": "#797876",
      "contrast_600": "#62615F",
      "contrast_700": "#4B4A49",
      "contrast_800": "#353535",
      "contrast_900": "#2A2A2A",
      "contrast_950": "#14141F",
      "contrast_975": "#101019",
      "contrast_1000": "#0C0C15"
    },
    "neutralSubduedOverrides": {
      "contrast_900": "#20202C",
      "contrast_950": "#1A1A25",
      "contrast_975": "#161620",
      "contrast_1000": "#14141F"
    },
    "accents": {
      "purple": {
        "primary_25": "#F8F7FF",
        "primary_50": "#F1F0FF",
        "primary_100": "#E4E0FF",
        "primary_200": "#D0C9FF",
        "primary_300": "#B3A9FF",
        "primary_400": "#8979FF",
        "primary_500": "#563FFF",
        "primary_600": "#4C37E0",
        "primary_700": "#3E2DB8",
        "primary_800": "#2E228A",
        "primary_900": "#221966",
        "primary_950": "#181247",
        "primary_975": "#0F0B2E"
      }
    },
    "defaultAccent": "purple"
  },
  "oauth": {
    "$comment": "scope = what NEW logins request (keep transitional-only so every PDS accepts it). declaredScope = superset advertised in client metadata (must cover step-ups like identity:handle AND any scope older cached bundles still request). See src/config/oauth.ts.",
    "defaultBaseUrl": "https://oso.social",
    "clientName": "oso",
    "scope": "atproto transition:generic transition:email transition:chat.bsky",
    "declaredScope": "atproto transition:generic transition:email transition:chat.bsky identity:handle account:email?action=manage account:status?action=manage",
    "handleResolver": "https://bsky.social",
    "signupPdsHost": "https://pds.oso.social"
  },
  "links": {
    "tos": "https://oso.social/about/terms.html",
    "privacy": "https://oso.social/about/privacy.html",
    "community": "https://oso.social/about/guidelines.html",
    "copyright": "https://oso.social/about/copyright.html",
    "support": "https://hello.mu.social/contact",
    "faq": "https://oso.social/about/faq.html",
    "dataPrivacy": "https://blueskyweb.zendesk.com/hc/en-us/articles/15835264007693-Data-Privacy",
    "helpDesk": "https://hello.mu.social/contact",
    "supportRequest": "https://hello.mu.social/contact",
    "download": "https://bsky.app/download",
    "statusPage": "https://status.bsky.app/",
    "donate": "https://doneer.waag.org/oso",
    "feedback": "https://userinput.app/s/did:plc:crzflbsprcjobktyhtjdated/3myfscso2qe2w"
  },
  "services": {
    "pds": "https://bsky.social",
    "pdsDid": "did:web:bsky.social",
    "publicApi": "https://public.api.bsky.app",
    "appView": "https://api.bsky.app",
    "appViewDid": "did:web:api.bsky.app",
    "chat": "https://api.bsky.chat",
    "embed": "https://embed.bsky.app",
    "gif": "https://gifs.bsky.app",
    "video": "https://video.bsky.app",
    "videoDid": "did:web:video.bsky.app",
    "cdn": "https://cdn.bsky.app",
    "ogCard": "https://ogcard.cdn.bsky.app"
  },
  "verification": {
    "trustedVerifierListUris": [
      "at://did:plc:ooensn4mr5mhznzypvxelfa3/app.bsky.graph.list/3mogaw2g4an23"
    ],
    "includeBlueskyVerifications": true
  },
  "ageAssurance": {
    "serviceUrl": "https://age.mu.social",
    "serviceDid": "did:web:age.mu.social"
  },
  "decorations": {
    "$comment": "Eurosky+ profile decorations. Set enabled=false to remove the UI and read path completely. subscriberListUris are exact app.bsky.graph.list records whose members get access. Test builds override these values with EXPO_PUBLIC_DECO_* variables.",
    "enabled": false,
    "subscriberListUris": [],
    "serviceUrl": "https://deco.mu.social",
    "serviceDid": "did:web:deco.mu.social",
    "manageUrl": "https://mu.social/settings/decorations"
  }
}
